species,keys,description,location
Pterocarpus erinaceus,0000 1010 0010 0010,"Pterocarpus erinaceus, commonly known as Saharan Rosewood or Karit, is a tree species with distinct morphological characteristics that aid in its identification:

1. Size and Habit: Saharan Rosewood is a medium to large-sized tree that can reach heights of 15-30 meters (49-98 feet). It has a straight, tall trunk with grayish-brown bark that becomes rough and fissured on older trees.

2. Leaves: The leaves of Pterocarpus erinaceus are alternate and compound, with a pinnate arrangement of leaflets. Each leaflet is small, oval, and wavy-edged. The leaves provide a feathery appearance.

3. Flowers: Saharan Rosewood produces small, reddish flowers that are arranged in elongated clusters at the ends of branches. The flowers are often grouped in dense inflorescences.

4. Fruits: The fruit of Pterocarpus erinaceus is a flat, winged pod that contains seeds. The pods are distinctive with their winged edges.

5. Timber and Uses: The wood of Saharan Rosewood is highly valued for its beautiful reddish-brown color and is used in fine furniture making, carvings, and crafts. It is also known for its resistance to termites.

6. Habitat: Saharan Rosewood is commonly found in a variety of habitats, including dry woodlands, savannahs, and desert margins, often in arid regions.

By observing and noting these distinctive features, you can confidently identify Saharan Rosewood trees in their natural habitat. For accurate identification and to learn more about this species, consulting local botanical experts or using region-specific field guides is recommended.",Beside ELH
Pterocarpus osun,0000 1001 0010 0010,"Pterocarpus osun is commonly known as Osun or Camwood, and it is a species of tree with significant cultural and economic importance in certain regions. It is a well-known tree in West Africa, particularly in Nigeria, where it holds cultural and traditional significance.

Here are some key characteristics and information about Pterocarpus osun:

1. Size and Habit: Osun is a medium-sized deciduous tree that can reach heights of 10-20 meters (33-66 feet). It has a distinctive straight, cylindrical trunk with grayish-brown bark that may become rough and fissured on older trees.

2. Leaves: The leaves of Pterocarpus osun are alternate and pinnate, composed of several oval to elliptical leaflets. Each leaflet has a smooth margin. The leaves provide a feathery appearance.

3. Flowers: Osun produces small, yellowish flowers that are arranged in compact clusters at the ends of branches. The flowers may not be as showy as those of some other species.

4. Heartwood and Uses: The heartwood of Osun tree is highly valued for its deep reddish or orange color. It is used traditionally for dyeing fabrics and is a prominent ingredient in various cultural and religious practices.

5. Cultural Significance: Osun (Camwood) is widely used in traditional ceremonies, particularly in Yoruba culture in Nigeria, where it is associated with rituals, art, and cultural expressions.

6. Habitat: Osun trees are commonly found in woodlands, savannahs, and open areas in tropical and subtropical regions of West Africa.

Please note that while the above information provides a general overview of Pterocarpus osun, for accurate identification and to learn more about this species, especially its cultural significance, consulting local experts, cultural historians, or using region-specific resources is highly recommended.",Comsit
Securidaca longepeduncuata,0000 1000 0010 0010,"Securidaca longepedunculata, commonly known as Violet Tree or Lavender Tree, is a tree species with distinct morphological characteristics that aid in its identification:

1. Size and Habit: Violet Tree is a medium to large-sized deciduous tree that can reach heights of 15-25 meters (49-82 feet). It has a straight, tall trunk with grayish-brown bark that may become rough and fissured on older trees.

2. Leaves: The leaves of Securidaca longepedunculata are alternate and pinnate, composed of several oval to lanceolate leaflets. Each leaflet has a smooth margin. The leaves provide a feathery appearance.

3. Flowers: Violet Tree produces small, violet to lavender-colored flowers that are arranged in long, pendulous racemes at the ends of branches. The flowers have a unique and attractive appearance.

4. Fruits: The fruit of Securidaca longepedunculata is a flat, elongated pod that contains seeds. The pods are typically brown and split open to release the seeds.

5. Medicinal Uses: Different parts of Violet Tree have been used in traditional medicine for various purposes, including treatment of infections, fever, and digestive issues.

6. Habitat: Violet Tree is commonly found in a variety of habitats, including woodlands, savannahs, and open areas, often in tropical and subtropical regions.

By observing and noting these distinctive features, you can confidently identify Violet Tree in its natural habitat. For accurate identification and to learn more about this species, consulting local botanical experts or using region-specific field guides is recommended.",faculty of pharmacy
Spondias mombin,0001 0001 0010 0010,"Spondias mombin, commonly known as Hog Plum, Yellow Mombin, or Jobo, is a tree species with distinct morphological characteristics that aid in its identification:

1. Size and Habit: Hog Plum is a medium-sized tree that can reach heights of 10-20 meters (33-66 feet). It has a rounded canopy with thick, green foliage.

2. Leaves: The leaves of Spondias mombin are alternate and pinnate, composed of several oval to lanceolate leaflets. The leaflets are dark green and have a smooth margin.

3. Flowers: Hog Plum produces small, greenish-white flowers that are arranged in terminal panicles at the ends of branches. The flowers are often not very showy.

4. Fruits: The fruit of Spondias mombin is a drupaceous fruit that is oval or elongated. The fruit is usually yellow when ripe and has a thin, edible skin covering the juicy pulp.

5. Edible Uses: The fruit of Hog Plum is edible and is enjoyed for its sweet and tangy flavor. It is used in various culinary preparations, including jams, jellies, and beverages.

6. Habitat: Hog Plum is commonly found in a variety of habitats, including forests, woodlands, and open areas, often in tropical and subtropical regions.

7. Medicinal Uses: Different parts of the Hog Plum tree have been used in traditional medicine for various purposes, including treating diarrhea, skin issues, and digestive problems.

By observing and noting these distinctive features, you can confidently identify Hog Plum trees in their natural habitat. For accurate identification and to learn more about this species, consulting local botanical experts or using region-specific field guides is recommended.",Teak nursery
Stereospermum kunthianum,0000 1111 0010 0010,"Stereospermum kunthianum, commonly known as Pink Jacaranda or Purple Trumpet Tree, is a tree species with distinct morphological characteristics that aid in its identification:

1. Size and Habit: Pink Jacaranda is a medium to large-sized tree that can reach heights of 15-30 meters (49-98 feet). It has a straight, tall trunk with grayish-brown bark that may become rough and fissured on older trees.

2. Leaves: The leaves of Stereospermum kunthianum are opposite and pinnate, composed of several oval to lanceolate leaflets. The leaves are dark green and provide a feathery appearance.

3. Flowers: Pink Jacaranda produces large, showy flowers that are typically pink to purple in color. The flowers have a distinctive trumpet shape and are arranged in terminal clusters at the ends of branches.

4. Fruits: The fruit of Stereospermum kunthianum is a capsule that contains numerous winged seeds. The capsules split open when mature, releasing the seeds.

5. Ornamental and Shade Tree: Pink Jacaranda is widely planted as an ornamental tree for its vibrant flowers and attractive foliage. It also provides shade in urban and landscaped areas.

6. Habitat: Pink Jacaranda is commonly found in a variety of habitats, including forests, woodlands, and open areas, often in tropical and subtropical regions.

By observing and noting these distinctive features, you can confidently identify Pink Jacaranda trees in their natural habitat. For accurate identification and to learn more about this species, consulting local botanical experts or using region-specific field guides is recommended.",Block 1
Strychnos innocua,0001 0100 0010 0011,"Strychnos innocua, commonly known as False Monkey Orange, is a tree species with distinct morphological characteristics that aid in its identification:

1. Size and Habit: False Monkey Orange is a medium to large-sized tree that can reach heights of 10-20 meters (33-66 feet). It has a rounded canopy with dense foliage.

2. Leaves: The leaves of Strychnos innocua are opposite and simple, with a smooth, glossy surface. The leaves are dark green and usually have a leathery texture.

3. Flowers: False Monkey Orange produces small, greenish-yellow to cream-colored flowers that are arranged in terminal clusters at the ends of branches. The flowers are often not very showy.

4. Fruits: The fruit of Strychnos innocua is a round, smooth-skinned berry that turns yellow to orange when ripe. The fruits are often edible and sweet.

5. Edible Uses: The fruit of False Monkey Orange is sometimes consumed by local communities for its sweet taste.

6. Habitat: False Monkey Orange is commonly found in a variety of habitats, including forests, woodlands, and open areas, often in tropical and subtropical regions.

7. Traditional Uses: Different parts of Strychnos innocua have been used in traditional medicine for various purposes, although the species is not to be confused with other Strychnos species that contain toxic compounds.

By observing and noting these distinctive features, you can confidently identify False Monkey Orange trees in their natural habitat. For accurate identification and to learn more about this species, consulting local botanical experts or using region-specific field guides is recommended.",faculty of pharmacy
Tamarindus indica,0000 1100 0010 0011,"Tamarindus indica, commonly known as Tamarind, is a tree species with distinct morphological characteristics that aid in its identification:

1. Size and Habit: Tamarind is a medium to large-sized tree that can reach heights of 15-25 meters (49-82 feet). It has a rounded canopy with open and airy foliage.

2. Leaves: The leaves of Tamarindus indica are alternate and pinnate, composed of several pairs of opposite leaflets with a single terminal leaflet. The leaflets are oblong and have a smooth margin.

3. Flowers: Tamarind produces small, yellowish to pale yellow flowers that are arranged in loose racemes at the ends of branches. The flowers are often not very showy.

4. Fruits: The fruit of Tamarindus indica is a large, brown pod that contains edible pulp. The pulp is sour and tangy in taste and is used in various culinary dishes.

5. Edible Uses: The pulp of Tamarind is widely used as a flavoring agent in cooking, especially in Asian and Middle Eastern cuisines. It is also used to make tamarind paste, sauces, and drinks.

6. Habitat: Tamarind trees are commonly found in a variety of habitats, including woodlands, savannahs, and cultivated areas, often in tropical and subtropical regions.

7. Medicinal Uses: Various parts of Tamarindus indica have been used in traditional medicine for their digestive and laxative properties.

By observing and noting these distinctive features, you can confidently identify Tamarind trees in their natural habitat. For accurate identification and to learn more about this species, consulting local botanical experts or using region-specific field guides is recommended.",Teak nursery
Tectona grandis,0001 0110 0111 0000,"Tectona grandis, commonly known as Teak, is a large tree species with distinct morphological characteristics that aid in its identification:

1. Size and Habit: Teak is a large-sized deciduous tree that can reach heights of 30-40 meters (98-131 feet). It has a straight, tall trunk with grayish-brown bark that becomes rough and fissured on older trees.

2. Leaves: The leaves of Tectona grandis are opposite and simple, with a smooth, leathery texture. The leaves are dark green and usually have a slightly serrated margin.

3. Flowers: Teak produces small, fragrant flowers that are arranged in clusters at the ends of branches. The flowers are often white to pale pink in color.

4. Fruits: The fruit of Tectona grandis is a small, woody capsule that contains tiny seeds. The capsules are often arranged in hanging clusters.

5. Timber and Uses: Teak wood is highly prized for its strength, durability, and resistance to decay. It is used extensively in fine furniture making, boat building, and construction due to its excellent properties.

6. Habitat and Distribution: Teak trees are commonly found in deciduous forests, tropical rainforests, and plantations in various tropical regions around the world.

7. Economic and Cultural Significance: Teak is not only an economically valuable timber tree but also holds cultural significance in various cultures and regions where it is grown.

By observing and noting these distinctive features, you can confidently identify Teak trees in their natural habitat. For accurate identification and to learn more about this species, consulting local botanical experts or using region-specific field guides is recommended.",Teak Plantation
Terminalia cattapar,0001 0010 0101 0011,"Terminalia catappa, commonly known as the Indian Almond, Tropical Almond, or Sea Almond, is a tree species with distinct morphological characteristics that aid in its identification:

1. Size and Habit: Terminalia catappa is a medium to large-sized tree that can reach heights of 15-25 meters (49-82 feet). It has a spreading canopy with drooping branches.

2. Leaves: The leaves of Terminalia catappa are alternate and simple, with a broad, elliptical shape. The leaves are dark green and often have a distinctive reddish-brown hue when young.

3. Flowers: Indian Almond produces small, inconspicuous flowers that are arranged in terminal spikes at the ends of branches. The flowers are usually greenish-white in color.

4. Fruits: The fruit of Terminalia catappa is a large, fleshy drupe that is flattened and almond-shaped. The outer husk of the fruit turns green to brown when mature, revealing the hard, woody shell containing the edible kernel.

5. Edible Kernel: The seed kernel inside the fruit is edible and is used in various culinary preparations. It has a nutty flavor and is often consumed raw, roasted, or used in traditional dishes.

6. Habitat and Distribution: Indian Almond trees are commonly found in tropical and subtropical regions around the world. They are often planted near coastal areas and are well-suited to a variety of habitats.

7. Cultural Uses: Terminalia catappa has cultural significance in various regions. In some places, the leaves are used for traditional and ceremonial purposes, and the tree itself is often grown for shade and ornamental purposes.

By observing and noting these distinctive features, you can confidently identify Indian Almond trees in their natural habitat. For accurate identification and to learn more about this species, consulting local botanical experts or using region-specific field guides is recommended.",Block 6
Terminalia gluascences,0001 0000 0010 0100,"Terminalia glaucescens, commonly known as the White Terminalia or Glaucous Terminalia, is a tree species with distinct morphological characteristics that aid in its identification:

1. Size and Habit: Terminalia glaucescens is a medium to large-sized tree that can reach heights of 20-30 meters (66-98 feet). It typically has a rounded or spreading canopy with drooping branches.

2. Leaves: The leaves of Terminalia glaucescens are alternate and simple, with a smooth-edged, elliptical to lanceolate shape. The leaves are green and often have a glaucous or waxy coating, giving them a slightly silvery appearance.

3. Flowers: White Terminalia produces small, pale yellow to cream-colored flowers that are arranged in terminal spikes or clusters at the ends of branches. The flowers may not be very showy.

4. Fruits: The fruit of Terminalia glaucescens is a woody capsule that contains small, winged seeds. The capsules may split open when mature to release the seeds.

5. Habitat and Distribution: White Terminalia is often found in woodlands, savannahs, and open areas in tropical and subtropical regions of Africa.

6. Timber and Uses: The wood of Terminalia glaucescens is utilized for various purposes, including construction, furniture making, and carvings. It is known for its durability and is valued for its quality.

7. Traditional and Medicinal Uses: Different parts of the tree have been used in traditional medicine by local communities for various purposes, although specific uses can vary.

By observing and noting these distinctive features, you can confidently identify White Terminalia trees in their natural habitat. For accurate identification and to learn more about this species, consulting local botanical experts or using region-specific field guides is recommended.",path leading to ile-apa community
Terminalia mantaly,0000 0010 0000 0010,"Terminalia mantaly, commonly known as Madagascar Almond or Mantaly, is a tree species with distinct morphological characteristics that aid in its identification:

1. Size and Habit: Terminalia mantaly is a medium-sized tree that can reach heights of 15-20 meters (49-66 feet). It has a rounded canopy with a dense arrangement of leaves.

2. Leaves: The leaves of Terminalia mantaly are alternate and simple, with a smooth-edged, oblong to elliptical shape. The leaves are dark green and often have a reddish hue when young.

3. Flowers: Madagascar Almond produces small, inconspicuous flowers that are arranged in terminal spikes at the ends of branches. The flowers are usually yellowish-green in color.

4. Fruits: The fruit of Terminalia mantaly is a large, woody capsule that is ellipsoid or ovoid in shape. The capsule contains several seeds.

5. Edible Seeds: The seeds of Terminalia mantaly are edible and are consumed in some cultures. They have a nutty flavor and are often roasted or cooked before eating.

6. Habitat and Distribution: Madagascar Almond is native to Madagascar and is often found in coastal and subcoastal forests in the region.

7. Traditional Uses: Different parts of the tree have been used in traditional medicine by local communities in Madagascar.

By observing and noting these distinctive features, you can confidently identify Madagascar Almond trees in their natural habitat. For accurate identification and to learn more about this species, consulting local botanical experts or using region-specific field guides is recommended.",Faculty of Agriculture
Vitellaria paradoxa,0101 0001 0010 0100,"Vitellaria paradoxa, commonly known as the Shea Tree or Shea Butter Tree, is a tree species with distinct morphological characteristics that aid in its identification:

1. Size and Habit: Shea Tree is a medium to large-sized tree that can reach heights of 12-20 meters (39-66 feet). It has a rounded canopy with dense foliage.

2. Leaves: The leaves of Vitellaria paradoxa are alternate and compound, typically composed of 5-9 leaflets. The leaflets are elliptical with a smooth margin. The leaves are dark green and provide a lush appearance.

3. Flowers: Shea Tree produces small, greenish-yellow flowers that are arranged in terminal panicles at the ends of branches. The flowers are often not very showy.

4. Fruits: The fruit of Vitellaria paradoxa is a green, plum-sized drupe that contains a large seed. The seed is enclosed in a hard, woody shell.

5. Shea Butter: The seed of the Shea Tree contains shea butter, a valuable vegetable fat that is widely used in cosmetics, skincare products, and cooking.

6. Habitat and Distribution: Shea Trees are commonly found in the Savannah regions of West Africa, particularly in countries such as Ghana, Nigeria, and Burkina Faso.

7. Economic and Cultural Significance: The shea butter extracted from the seeds has significant economic and cultural importance in West African communities. It is used for traditional medicine, skincare, haircare, and culinary purposes.

By observing and noting these distinctive features, you can confidently identify Shea Trees in their natural habitat. For accurate identification and to learn more about this species, consulting local botanical experts or using region-specific field guides is recommended.","Front of Architecture department, walkway, Faculty of Agriculture"
Vitex doniana,0000 0110 0010 0010,"Vitex doniana, commonly known as the African Black Plum or Doni, is a tree species with distinct morphological characteristics that aid in its identification:

1. Size and Habit: African Black Plum is a medium-sized tree that can reach heights of 10-15 meters (33-49 feet). It has a rounded canopy with a relatively dense arrangement of leaves.

2. Leaves: The leaves of Vitex doniana are opposite and palmately compound, typically composed of 3-7 leaflets. The leaflets are oval with a smooth margin. The leaves are dark green and provide a lush appearance.

3. Flowers: African Black Plum produces small, fragrant flowers that are arranged in terminal or axillary clusters at the ends of branches. The flowers are often white or pale pink in color.

4. Fruits: The fruit of Vitex doniana is a large, globose drupe that is green when young and turns purplish-black when ripe. The fruit contains a single seed and is edible.

5. Edible Fruit: The ripe fruit of African Black Plum is edible and is used in various culinary preparations, including jams, juices, and traditional dishes.

6. Habitat and Distribution: African Black Plum trees are commonly found in savannah woodlands and grasslands in various regions of Africa.

7. Cultural Uses: The fruit and other parts of the tree have been used for various purposes in traditional medicine and cultural practices in different African communities.

By observing and noting these distinctive features, you can confidently identify African Black Plum trees in their natural habitat. For accurate identification and to learn more about this species, consulting local botanical experts or using region-specific field guides is recommended.",Beside the school library
Sena siamea,1000 0110 0010 0010,"Senna siamea, commonly known as Siamese Cassia or Kassod Tree, is a tree species with distinct morphological characteristics that aid in its identification:

1. Size and Habit: Siamese Cassia is a medium to large-sized tree that can reach heights of 10-25 meters (33-82 feet). It has a rounded or spreading canopy with a straight, cylindrical trunk.

2. Leaves: The leaves of Senna siamea are alternate and compound, typically composed of pinnate leaflets. Each leaflet is oval with a smooth margin. The leaves are dark green and provide a lush appearance.

3. Flowers: Siamese Cassia produces large, showy flowers that are arranged in terminal clusters at the ends of branches. The flowers are usually yellow in color and have five distinct petals.

4. Fruits: The fruit of Senna siamea is a flat, brown pod that contains several seeds. The pods are elongated and have a slightly curved shape.

5. Ornamental and Shade Tree: Siamese Cassia is often planted as an ornamental tree for its attractive foliage and colorful flowers. It also provides shade in urban and landscaped areas.

6. Habitat and Distribution: Siamese Cassia is native to Southeast Asia and is commonly found in various types of forests, grasslands, and cultivated areas.

7. Timber and Uses: The wood of Senna siamea is utilized for construction, furniture making, and crafts. The tree is also valued for its medicinal and traditional uses in different cultures.

By observing and noting these distinctive features, you can confidently identify Siamese Cassia trees in their natural habitat. For accurate identification and to learn more about this species, consulting local botanical experts or using region-specific field guides is recommended.",Unilorin zoo
