species,keys,description,location
Cassia fistula,0000 1101 0010 0010,"Cassia fistula, commonly known as Golden Shower Tree or Indian Laburnum, is a tree species with distinct morphological characteristics that aid in its identification:

1. Size and Habit: Golden Shower Tree is a medium-sized to large tree that can reach heights of 10-20 meters (33-66 feet). It has a graceful, spreading canopy with feathery foliage.

2. Leaves: The leaves of Cassia fistula are alternate and pinnately compound, consisting of 5-8 pairs of leaflets and a terminal leaflet. Each leaflet is oblong or elliptical in shape, with a smooth margin. The leaves are bright green and provide an elegant appearance.

3. Flowers: Golden Shower Tree produces large, showy flowers that are typically bright yellow in color. The flowers are arranged in long, hanging clusters known as racemes that drape down from the branches.

4. Fruits: The fruit of Cassia fistula is a long, cylindrical pod that is initially green and turns brown as it matures. The pod contains numerous dark brown to black seeds.

5. Flowering Season: Golden Shower Tree is known for its abundant flowering during certain times of the year, depending on the local climate and growing conditions.

6. Ornamental Value: Due to its striking flowers and attractive foliage, Cassia fistula is often cultivated as an ornamental tree in gardens and landscapes.

7. Medicinal and Cultural Uses: Different parts of the Golden Shower Tree have traditional medicinal uses in various cultures. The tree's flowers are used in herbal remedies, and the wood is sometimes used in traditional crafts.

By observing and noting these distinctive features, you can confidently identify Golden Shower Tree in its natural habitat or in cultivated settings. For accurate identification and to learn more about this species, consulting local botanical experts or using region-specific field guides is recommended.",Beside the school library
Casuarina equisetofolia,0001 0000 1010 0010,"Casuarina equisetifolia, commonly known as Casuarina, Ironwood, or Australian Pine, is a tree species with distinct morphological characteristics that aid in its identification:

1. Size and Habit: Casuarina equisetifolia is a medium to large tree that can reach heights of 20-35 meters (66-115 feet). It has a slender, conical or columnar shape with drooping, fern-like branches that resemble pine needles.

2. Leaves: The leaves of Casuarina equisetifolia are reduced to scale-like structures that encircle the stem nodes. These scale-like structures are green and whorled around the branches, resembling the appearance of pine needles.

3. Branches: The branches of Casuarina equisetifolia are jointed, similar to bamboo, and give the tree its distinctive appearance. The branch segments are verticillate, meaning they are arranged in whorls around the stem.

4. Flowers: Casuarina produces inconspicuous, unisexual flowers that are arranged in small, cylindrical, woody cones known as strobili. Male and female cones are borne on separate trees.

5. Fruits: The fruit of Casuarina equisetifolia is a small, woody cone that contains tiny winged seeds adapted for wind dispersal.

6. Habitat: Casuarina equisetifolia is commonly found in coastal and beach environments, often growing in sandy soils near the sea.

7. Uses: Casuarina is valued for its rapid growth and ability to stabilize coastal sand dunes. It is often planted for erosion control and as a windbreak in coastal areas. Additionally, the wood of Casuarina trees is used for fuel and in construction.

By observing and noting these distinctive features, you can confidently identify Casuarina equisetifolia in its natural habitat. For accurate identification and to learn more about this species, consulting local botanical experts or using region-specific field guides is recommended.",ELT(Engineering Lecture Theatre)
Crescenta cujeta,0001 0010 0010 0000,"Crescentia cujete, commonly known as Calabash Tree or Cujo, is a tree species with distinct morphological characteristics that aid in its identification:

1. Size and Habit: Calabash Tree is a medium-sized to large tree that can reach heights of 8-15 meters (26-49 feet). It has a low, spreading canopy with thick, leathery leaves.

2. Leaves: The leaves of Crescentia cujete are simple, alternate, and large. They are rounded or heart-shaped with a smooth margin. The leaves are dark green and provide an attractive appearance.

3. Flowers: Calabash Tree produces large, showy flowers that are typically greenish-yellow in color. The flowers are arranged in clusters that emerge from the branches and have a unique shape resembling a pipe or tube.

4. Fruits: The fruit of Crescentia cujete is a large, globular or ellipsoid gourd with a hard, woody shell. The shell is initially green and turns brown as it matures. The interior of the fruit is hollow and can be used for various purposes.

5. Uses: The hard shell of the fruit is often used for crafts and containers such as bowls, cups, and musical instruments. In some cultures, the shell is used to make traditional percussion instruments known as ""maracas"" or ""guiros."" The young fruit may also be used for culinary purposes.

6. Habitat: Calabash Trees are commonly found in a variety of habitats, including tropical forests, woodlands, and coastal areas, often in tropical and subtropical regions.

By observing and noting these distinctive features, you can confidently identify Calabash Tree in its natural habitat or in cultivated settings. For accurate identification and to learn more about this species, consulting local botanical experts or using region-specific field guides is recommended.",Teak nursery
Daniellia oliveri,0000 1001 0010 0011,"Daniellia oliveri, commonly known as Daniellia or African Copalwood, is a tree species with distinct morphological characteristics that aid in its identification:

1. Size and Habit: Daniellia oliveri is a medium-sized to large tree that can reach heights of 20-30 meters (66-98 feet). It has a straight, cylindrical trunk with grayish-brown bark that is often smooth on younger trees and becomes rough and fissured on older trees.

2. Leaves: The leaves of Daniellia oliveri are alternate and compound, consisting of 5-7 pairs of leaflets and a terminal leaflet. Each leaflet is oblong or elliptical in shape, with a smooth margin. The leaves are dark green and provide dense foliage.

3. Flowers: Daniellia produces small, fragrant flowers that are typically yellow or cream-colored. The flowers are arranged in axillary clusters that are often densely packed.

4. Fruits: The fruit of Daniellia oliveri is a flat, elliptical pod that contains several seeds. The pods are dark brown and have a distinctive shape.

5. Habitat: Daniellia is commonly found in various habitats, including rainforests, woodlands, and savannahs, often in tropical and subtropical regions.

6. Timber: The wood of Daniellia oliveri is valued for its hardness and durability. It is used for various purposes, including construction, furniture making, and carvings.

By observing and noting these distinctive features, you can confidently identify Daniellia oliveri in its natural habitat. For accurate identification and to learn more about this species, consulting local botanical experts or using region-specific field guides is recommended.","Faculty of Agriculture mosque, School library"
Delonix regia,0000 0101 0010 1010,"Delonix regia, commonly known as Flamboyant Tree or Royal Poinciana, is a tree species with distinct morphological characteristics that aid in its identification:

1. Size and Habit: Flamboyant Tree is a large tree that can reach heights of 5-12 meters (16-39 feet) or more. It has a wide-spreading canopy with feathery, fern-like foliage that provides ample shade underneath.

2. Leaves: The leaves of Delonix regia are alternate and finely pinnate, meaning they are divided into many small leaflets. Each leaflet is oval or lanceolate in shape and has a smooth margin. The leaves are dark green and give the tree a lush appearance.

3. Flowers: Flamboyant Tree produces large, striking flowers that are typically red or orange in color. The flowers have five unequal petals with the uppermost petal being the largest and most prominent. The flowers are arranged in terminal clusters at the ends of branches.

4. Fruits: The fruit of Delonix regia is a flat, brown, woody pod that can reach lengths of 30-60 cm (12-24 inches). The pods contain several hard, dark seeds that are surrounded by a fibrous material.

5. Flowering Season: Flamboyant Trees are known for their spectacular flowering display during certain times of the year, depending on the local climate and growing conditions.

6. Ornamental Value: Due to its vibrant flowers and unique foliage, Delonix regia is often cultivated as an ornamental tree in gardens, parks, and urban landscapes.

7. Cultural Significance: The Flamboyant Tree holds cultural significance in various regions and is the national flower of Barbados. It is also associated with festivals and celebrations in some cultures.

By observing and noting these distinctive features, you can confidently identify Flamboyant Trees in their natural habitat or in cultivated settings. For accurate identification and to learn more about this species, consulting local botanical experts or using region-specific field guides is recommended.",opposite Faculty of Agriculture
Detarium microcarpum,0000 1001 0000 0010,"Detarium microcarpum, commonly known as Toddy Tree or African Locust Bean, is a tree species with distinct morphological characteristics that aid in its identification:

1. Size and Habit: Toddy Tree is a medium-sized to large tree that can reach heights of 15-30 meters (49-98 feet). It has a rounded canopy with dense foliage.

2. Bark: The bark of Detarium microcarpum is grayish-brown and becomes rough and deeply furrowed as the tree matures.

3. Leaves: The leaves are alternate and pinnately compound, consisting of 5-9 pairs of leaflets and a terminal leaflet. Each leaflet is oval or elliptical in shape, with a smooth margin. The leaves are dark green and provide dense foliage.

4. Flowers: Toddy Tree produces small, inconspicuous flowers that are typically greenish-white in color. The flowers are arranged in long, hanging racemes that emerge from the branches.

5. Fruits: The fruit of Detarium microcarpum is a large, flattened, woody pod that contains several seeds embedded in a sweet, edible pulp.

6. Edible Use: The sweet pulp surrounding the seeds is consumed and is often used to make a fermented beverage known as ""palm wine"" or ""toddy."" The seeds are also used in traditional culinary preparations in some regions.

7. Medicinal and Cultural Uses: Different parts of the Toddy Tree have traditional medicinal uses in various cultures. The tree is also used for its timber and fodder for livestock.

By observing and noting these distinctive features, you can confidently identify Toddy Trees in their natural habitat. For accurate identification and to learn more about this species, consulting local botanical experts or using region-specific field guides is recommended.",In front of professorial suite at the faculty of Agriculture
Entanda africana,0000 0100 0010 1001,"Entandrophragma angolense, commonly known as African Mahogany or Entandrophragma, is a tree species with distinct morphological characteristics that aid in its identification:

1. Size and Habit: African Mahogany is a large tree that can reach heights of 30-45 meters (98-148 feet). It has a straight, tall trunk with grayish to reddish-brown bark that is often smooth on younger trees and becomes rough and fissured on older trees.

2. Leaves: The leaves of Entandrophragma angolense are alternate and compound, consisting of 5-9 pairs of leaflets and a terminal leaflet. Each leaflet is oblong or elliptical in shape, with a smooth margin. The leaves are dark green and provide dense foliage.

3. Flowers: African Mahogany produces small, inconspicuous flowers that are typically cream-colored or yellowish. The flowers are arranged in terminal panicles that emerge from the branches.

4. Fruits: The fruit of Entandrophragma angolense is a large, woody capsule that contains numerous winged seeds. The capsules split open to release the seeds, which are adapted for wind dispersal.

5. Timber: The wood of African Mahogany is highly prized for its attractive appearance, durability, and workability. It is used in fine furniture making, cabinetry, and veneer, among other applications.

6. Habitat: African Mahogany is commonly found in various habitats, including rainforests, woodlands, and savannahs, often in tropical and subtropical regions.

By observing and noting these distinctive features, you can confidently identify African Mahogany trees in their natural habitat. For accurate identification and to learn more about this species, consulting local botanical experts or using region-specific field guides is recommended.","Unilorin zoo, Path leading to ile-apa community"
Eucalyptus camendulensis,0000 1001 1010 0001,"Eucalyptus camaldulensis, commonly known as Red River Gum, is a tree species with distinct morphological characteristics that aid in its identification:

1. Size and Habit: Red River Gum is a large tree that can reach heights of 20-45 meters (66-148 feet). It has a straight, tall trunk with grayish to reddish-brown bark that is often peeling in strips.

2. Leaves: The leaves of Eucalyptus camaldulensis are alternate and simple, with a lanceolate or sickle-shaped form. The leaves are leathery and gray-green in color. They are arranged vertically to reduce water loss through transpiration.

3. Flowers: Red River Gum produces small, white or cream-colored flowers that are arranged in clusters known as umbels. The flowers have numerous stamens that give them a distinctive appearance.

4. Fruits: The fruit of Eucalyptus camaldulensis is a woody, bell-shaped capsule known as a gumnut. The gumnuts contain numerous small seeds and are often persistent on the tree.

5. Habitat: Red River Gum is commonly found in a variety of habitats, including riverbanks, floodplains, and wetlands, often in temperate and subtropical regions.

6. Cultural Significance: Red River Gum holds cultural significance for Indigenous Australian communities and has been used for various purposes, including traditional medicine and tool-making.

7. Uses: The wood of Eucalyptus camaldulensis is highly valued for its hardness and durability. It is used in construction, furniture making, and firewood.

By observing and noting these distinctive features, you can confidently identify Red River Gum trees in their natural habitat. For accurate identification and to learn more about this species, consulting local botanical experts or using region-specific field guides is recommended.",Motion Ground
Ficus exasperata,0101 0001 0100 0001,"Ficus exasperata, commonly known as Sandpaper Fig or Knobbly Fig, is a tree species with distinct morphological characteristics that aid in its identification:

1. Size and Habit: Sandpaper Fig is a medium-sized to large tree that can reach heights of 10-20 meters (33-66 feet). It has a rounded canopy with dense foliage.

2. Leaves: The leaves of Ficus exasperata are alternate and simple, with a oval or elliptical shape. The leaves have a distinctive sandpapery texture on both sides, which gives the tree its common name. The leaves are dark green and may have a slightly leathery feel.

3. Fruits: The fruit of Sandpaper Fig is a small, round fig that is typically green when young and turns purple-black when ripe. The figs are edible and are often consumed by birds and other wildlife.

4. Habitat: Sandpaper Fig is commonly found in various habitats, including rainforests, woodlands, and riparian areas, often in tropical and subtropical regions.

5. Growth Habit: The branches of Ficus exasperata often have distinctive knobbly growths or galls along the stems, adding to its unique appearance.

6. Ecological Importance: Sandpaper Fig is an important tree in many ecosystems as it provides food and shelter for various wildlife species.

By observing and noting these distinctive features, you can confidently identify Sandpaper Fig trees in their natural habitat. For accurate identification and to learn more about this species, consulting local botanical experts or using region-specific field guides is recommended.",Opposite Unilorin Microfinance Bank
Ficus sycomorous,0101 0001 0110 0001,"Ficus sycomorus, commonly known as the Sycamore Fig, is a tree species with distinct morphological characteristics that aid in its identification:

1. Size and Habit: Sycamore Fig is a large tree that can reach heights of 10-20 meters (33-66 feet) or more. It has a rounded canopy with dense, spreading foliage.

2. Leaves: The leaves of Ficus sycomorus are alternate and simple, with a rough, sandpapery texture on the upper surface. The leaves are heart-shaped with a pointed tip and prominent veins. They are dark green and provide ample shade.

3. Fruits: The fruit of Sycamore Fig is a distinctive, pear-shaped fig that is typically green when young and turns yellow or orange when ripe. The figs are often clustered along the branches and have a unique appearance.

4. Habitat: Sycamore Fig is commonly found in a variety of habitats, including riparian zones, riverbanks, and wetlands, often in tropical and subtropical regions.

5. Ecological Importance: Sycamore Fig trees play a crucial role in supporting various wildlife species by providing food in the form of figs and shelter in their branches.

6. Cultural Significance: The Sycamore Fig has cultural and historical significance in various regions and is mentioned in ancient texts and scriptures.

By observing and noting these distinctive features, you can confidently identify Sycamore Fig trees in their natural habitat. For accurate identification and to learn more about this species, consulting local botanical experts or using region-specific field guides is recommended.",In front of NOC(Network Operations center)
Ficus thonnigi,0101 0001 0110 0101,"Ficus thonningii, commonly known as the Thonning's Fig or Bantu Fig, is a tree species with distinct morphological characteristics that aid in its identification:

1. Size and Habit: Thonning's Fig is a medium-sized to large tree that can reach heights of 15-25 meters (49-82 feet). It has a rounded to spreading canopy with dense foliage.

2. Leaves: The leaves of Ficus thonningii are alternate and simple, with a smooth and glossy texture on the upper surface. The leaves are elliptical or ovate in shape with a pointed tip and a smooth margin. They are dark green and provide ample shade.

3. Fruits: The fruit of Thonning's Fig is a small, round fig that turns from green to yellow when ripe. The figs are often clustered along the branches and have a distinctive appearance.

4. Habitat: Thonning's Fig is commonly found in a variety of habitats, including forests, woodlands, and savannahs, often in tropical and subtropical regions.

5. Ecological Importance: Thonning's Fig trees are ecologically significant as they provide food in the form of figs for various wildlife species, including birds and mammals.

6. Traditional Uses: In some cultures, the fruits and leaves of the Thonning's Fig are used for medicinal and culinary purposes.

By observing and noting these distinctive features, you can confidently identify Thonning's Fig trees in their natural habitat. For accurate identification and to learn more about this species, consulting local botanical experts or using region-specific field guides is recommended.",Opposite ELT(Engineering lecture theatre)
Gliricida sepium,0000 1101 0010 0010,"Gliricidia sepium, commonly known as Gliricidia, Quickstick, or Mexican Lilac, is a tree species with distinct morphological characteristics that aid in its identification:

1. Size and Habit: Gliricidia sepium is a small to medium-sized tree that can reach heights of 5-15 meters (16-49 feet). It has a spreading, bushy canopy with feathery foliage.

2. Leaves: The leaves of Gliricidia sepium are alternate and compound, consisting of 5-7 pairs of leaflets and a terminal leaflet. Each leaflet is oblong or lanceolate in shape, with a smooth margin. The leaves are bright green and provide an attractive appearance.

3. Flowers: Gliricidia produces showy, pink to purple flowers that are arranged in terminal racemes at the ends of branches. The flowers have a distinct butterfly-like shape with five petals.

4. Fruits: The fruit of Gliricidia sepium is a flat, elongated pod that contains several seeds. The pods are green when young and turn brown as they mature.

5. Uses: Gliricidia is valued for its fast growth and various uses. It is often planted for soil improvement, erosion control, and as a shade tree in agroforestry systems. The leaves and young pods are used as forage for livestock, and the wood can be used for firewood and crafts.

6. Medicinal and Cultural Uses: Different parts of the Gliricidia tree have traditional medicinal uses in various cultures.

By observing and noting these distinctive features, you can confidently identify Gliricidia sepium in its natural habitat or in cultivated settings. For accurate identification and to learn more about this species, consulting local botanical experts or using region-specific field guides is recommended.",At the back of Faculty of Agriculture
Gmelina arborea,0001 0101 0110 0101,"Gmelina arborea, commonly known as Gmelina or White Teak, is a tree species with distinct morphological characteristics that aid in its identification:

1. Size and Habit: Gmelina arborea is a medium to large tree that can reach heights of 20-35 meters (66-115 feet). It has a straight, cylindrical trunk with grayish-brown bark that becomes rough and fissured on older trees.

2. Leaves: The leaves of Gmelina arborea are opposite and simple, with a long oval or elliptical shape. The leaves have a smooth margin and are dark green in color. They are arranged in an alternate phyllotaxy along the branches.

3. Flowers: Gmelina produces showy, fragrant flowers that are typically yellow or orange in color. The flowers are arranged in terminal panicles at the ends of branches.

4. Fruits: The fruit of Gmelina arborea is a capsule that contains numerous winged seeds. The capsules are green when young and turn brown as they mature.

5. Timber: The wood of Gmelina arborea is highly valued for its lightweight, durable, and versatile properties. It is used for various purposes, including furniture making, construction, and paper production.

6. Uses: Gmelina is often planted for afforestation, agroforestry, and reforestation purposes. It can provide shade and shelter to other crops and is considered a valuable tree for sustainable land management.

7. Medicinal and Traditional Uses: Different parts of the Gmelina tree have traditional medicinal uses in various cultures.

By observing and noting these distinctive features, you can confidently identify Gmelina arborea in its natural habitat or in cultivated settings. For accurate identification and to learn more about this species, consulting local botanical experts or using region-specific field guides is recommended.",School park
Hildergardia barteri,0001 0001 0100 0101,"Hildegardia barteri, commonly known as African Whitewood or Lagos Mahogany, is a tree species with distinct morphological characteristics that aid in its identification:

1. Size and Habit: African Whitewood is a large tree that can reach heights of 30-45 meters (98-148 feet). It has a straight, tall trunk with grayish-brown bark that may become rough and fissured on older trees.

2. Leaves: The leaves of Hildegardia barteri are alternate and compound, consisting of 5-7 pairs of leaflets and a terminal leaflet. Each leaflet is lanceolate or oblong in shape, with a smooth margin. The leaves are dark green and provide dense foliage.

3. Flowers: African Whitewood produces large, fragrant flowers that are typically white to pale pink in color. The flowers are arranged in terminal panicles that emerge from the branches.

4. Fruits: The fruit of Hildegardia barteri is a large, woody capsule that contains several seeds. The capsules split open to release the seeds.

5. Timber: The wood of African Whitewood is valued for its lightweight and durable properties. It is used for various purposes, including construction, furniture making, and carving.

6. Habitat: African Whitewood is commonly found in various habitats, including rainforests, woodlands, and savannahs, often in tropical and subtropical regions.

By observing and noting these distinctive features, you can confidently identify African Whitewood trees in their natural habitat. For accurate identification and to learn more about this species, consulting local botanical experts or using region-specific field guides is recommended.",entrance to french department
